<?xml version="1.0" encoding="UTF-8"?>
<!--
-->
<employments
    xmlns:xsi='http://www.w3.org/2001/XMLSchema-instance'
    xmlns='http://www.example.com/employments'
    xsi:schemaLocation='http://www.example.com/employments Schema.xsd'>
    <employment group="PI-1-16">
        <countStudent>18</countStudent>
        <subject>
            <nameSub>Math</nameSub>
            <time>Tuesday</time>
        </subject>
        <teaher>
            <fio>Иванов Иван Иванович</fio>
            <countPairTime>2</countPairTime>
        </teaher>
    </employment>
    <employment group="ISP-1-17">
        <countStudent>25</countStudent>
        <subject>
            <nameSub>Literature</nameSub>
            <time>Friday</time>
        </subject>
        <teaher>
            <fio>Силоров Сергей Михайлович</fio>
            <countPairTime>3</countPairTime>
        </teaher>
    </employment>

</employments>
